{
  "$schema": "http://json-schema.org/draft-07/schema#",
  "$id": "https://pmcram.app/schema/question.schema.json",
  "title": "PM Cram practice question",
  "description": "A single practice/exam question. The app assembles the on-screen options at runtime from `correct` + `distractors`, so options are never hard-coded as A/B/C/D and never appear in a fixed order.",
  "type": "object",
  "required": ["domain", "type", "select", "present", "prompts", "correct", "distractors"],
  "additionalProperties": false,
  "properties": {
    "id": { "type": "string", "description": "OPTIONAL. The app derives a stable id from the question's content when none is given, so contributors don't need to invent or track ids. Set one only to pin a correctable identity (kebab-case); never reuse an existing id.", "pattern": "^[a-z0-9][a-z0-9-]*$" },
    "schema": { "type": "string", "const": "question/v1" },
    "domain": { "type": "string", "enum": ["People", "Process", "Business Environment"], "description": "PMP ECO domain." },
    "eco_task": { "type": "string", "description": "ECO task / enabler this question maps to (free text)." },
    "topic": { "type": "string" },
    "subtopic": { "type": "string" },
    "difficulty": { "type": "string", "enum": ["easy", "medium", "hard"] },
    "type": { "type": "string", "enum": ["single", "multi"], "description": "single = choose one; multi = choose N." },
    "select": { "type": "integer", "minimum": 1, "description": "How many options the user must choose. Must equal the number of entries in `correct`." },
    "present": { "type": "integer", "minimum": 2, "description": "Total options to render = correct shown + distractors sampled. Must be > select and <= (correct.length + distractors.length)." },
    "prompts": {
      "type": "array",
      "minItems": 1,
      "items": { "type": "string" },
      "description": "One or more equivalent wordings of the same question. The app picks one at random so repeat exposures feel fresh."
    },
    "correct": {
      "type": "array",
      "minItems": 1,
      "description": "The correct option(s). For `multi`, length should equal `select`.",
      "items": {
        "type": "object",
        "required": ["text"],
        "additionalProperties": false,
        "properties": {
          "text": { "type": "string" },
          "why": { "type": "string", "description": "Per-option explanation of why it is correct (shown on review)." }
        }
      }
    },
    "distractors": {
      "type": "array",
      "minItems": 1,
      "description": "Pool of wrong answers. Provide MORE than needed — the app samples `present - select` of them each time so the wrong set varies.",
      "items": {
        "type": "object",
        "required": ["text"],
        "additionalProperties": false,
        "properties": {
          "text": { "type": "string" },
          "trap": { "type": "string", "description": "Why this option is wrong / the misconception it represents (shown on review)." }
        }
      }
    },
    "explanation": { "type": "string", "description": "Overall rationale shown after answering." },
    "references": { "type": "array", "items": { "type": "string" }, "description": "PMI standard + section/page citations." },
    "tags": { "type": "array", "items": { "type": "string" } },
    "contributor": { "type": "string", "description": "Optional GitHub handle of the contributor." }
  }
}
