[
  {
    "id": "risk-0001",
    "schema": "question/v1",
    "domain": "Process",
    "eco_task": "Assess and Manage Risks",
    "topic": "Risk",
    "subtopic": "Identify Risks",
    "difficulty": "easy",
    "type": "single",
    "select": 1,
    "present": 4,
    "prompts": [
      "During the execution phase of a project, a project team identifies a previously unforeseen risk that could delay the project for several months. What should the project manager do first?",
      "Midway through execution, the team surfaces a new risk that was never identified during planning and that could cause a multi-month delay. What is the BEST first action?"
    ],
    "correct": [
      {
        "text": "Update the risk register",
        "why": "A newly identified risk must first be documented and tracked in the risk register so it can be analysed and a response planned through the normal process."
      }
    ],
    "distractors": [
      { "text": "Perform qualitative risk analysis", "trap": "Analysis comes after the risk is recorded; you cannot prioritise what has not yet been captured." },
      { "text": "Update the project sponsors", "trap": "Communication may follow, but escalating before documenting skips the controlled process." },
      { "text": "Plan for additional budget", "trap": "Jumps straight to a response before the risk is recorded, analysed, or prioritised." },
      { "text": "Add a contingency reserve immediately", "trap": "Reserves are set against analysed, known risks — premature here." }
    ],
    "explanation": "Identify Risks documents new risks and their characteristics as they arise. Recording the risk in the register is the first step; analysis, response planning, and stakeholder communication follow.",
    "references": ["PMBOK Guide Seventh Edition — 2.8.5 Risk", "The Standard for Risk Management in Portfolios, Programs, and Projects (2019)"],
    "tags": ["risk-register", "identify-risks"]
  },
  {
    "id": "risk-0002",
    "schema": "question/v1",
    "domain": "Process",
    "eco_task": "Assess and Manage Risks",
    "topic": "Risk",
    "subtopic": "Risk responses",
    "difficulty": "medium",
    "type": "single",
    "select": 1,
    "present": 4,
    "prompts": [
      "A project manager decided to involve a third party to manage a project risk because they had more experience than the current team. Which threat response strategy did the project manager apply?"
    ],
    "correct": [
      {
        "text": "Transfer",
        "why": "Transference shifts the impact of a threat — and ownership of the response — to a third party better positioned to manage it."
      }
    ],
    "distractors": [
      { "text": "Avoid", "trap": "Avoidance eliminates the threat or its exposure; here the threat still exists, it is just handled by someone else." },
      { "text": "Exploit", "trap": "Exploit is an opportunity (positive risk) strategy, not a threat strategy." },
      { "text": "Mitigate", "trap": "Mitigation reduces probability or impact directly; bringing in a third party shifts ownership rather than reducing the risk itself." },
      { "text": "Escalate", "trap": "Escalation applies when the response is outside the project's scope or authority — not the case here." }
    ],
    "explanation": "Transferring a threat moves both its impact and the ownership of the response to a third party, often via contract or insurance.",
    "references": ["PMBOK Guide Seventh Edition — 2.8.5.1 Threats", "The Standard for Risk Management (2019)"],
    "tags": ["threat-response", "transfer"]
  },
  {
    "id": "risk-0003",
    "schema": "question/v1",
    "domain": "Process",
    "eco_task": "Assess and Manage Risks",
    "topic": "Risk",
    "subtopic": "Risk vs issue",
    "difficulty": "medium",
    "type": "multi",
    "select": 2,
    "present": 4,
    "prompts": [
      "What distinguishes risks from issues? (Choose two.)"
    ],
    "correct": [
      { "text": "Risks are uncertain and issues are certain", "why": "A risk is an uncertain future event; an issue is a current condition that has already occurred." },
      { "text": "Risks may not occur and an issue has occurred", "why": "Risks are potential; issues are realities already affecting the project." }
    ],
    "distractors": [
      { "text": "Risks are certain and issues are uncertain", "trap": "Reversed — risks are the uncertain ones." },
      { "text": "Risks have occurred and issues may not occur", "trap": "Reversed — issues have occurred, risks may not." }
    ],
    "explanation": "A risk is an uncertain event or condition that, if it occurs, affects objectives. An issue is a current condition or situation that has already occurred and may impact objectives.",
    "references": ["PMBOK Guide Seventh Edition — 2.8.5 Risk", "The Standard for Risk Management (2019) — Glossary"],
    "tags": ["risk-vs-issue", "definitions"]
  },
  {
    "id": "risk-0004",
    "schema": "question/v1",
    "domain": "Process",
    "eco_task": "Assess and Manage Risks",
    "topic": "Risk",
    "subtopic": "Risk analysis tools",
    "difficulty": "hard",
    "type": "multi",
    "select": 4,
    "present": 6,
    "prompts": [
      "Which tools are suitable for risk analysis? (Choose four.)"
    ],
    "correct": [
      { "text": "Brainstorming", "why": "Generates a comprehensive list of individual risks and sources of overall risk." },
      { "text": "Risk checklists", "why": "Built from historical information and prior similar projects." },
      { "text": "Interviewing", "why": "Draws on expert input to assess individual risks and uncertainty." },
      { "text": "Decision tree analysis", "why": "Supports selecting the best of several alternative courses of action under uncertainty." }
    ],
    "distractors": [
      { "text": "Inspection", "trap": "Inspection examines a work product for conformance to standards — a quality tool, not risk analysis." },
      { "text": "Product evaluation", "trap": "Evaluates product/service quality against requirements, not risk." }
    ],
    "explanation": "Brainstorming, risk checklists, interviewing, and decision tree analysis are risk-analysis tools. Inspection and product evaluation are quality techniques.",
    "references": ["PMBOK Guide Sixth Edition — Chapter 11"],
    "tags": ["risk-analysis", "tools-techniques", "choose-four"]
  },
  {
    "id": "risk-0005",
    "schema": "question/v1",
    "domain": "Process",
    "eco_task": "Assess and Manage Risks",
    "topic": "Risk",
    "subtopic": "Monitor Risks",
    "difficulty": "medium",
    "type": "single",
    "select": 1,
    "present": 4,
    "prompts": [
      "Which tactic can a project manager employ to monitor the impact of risk on the project while monitoring risks?"
    ],
    "correct": [
      {
        "text": "Risk reporting",
        "why": "While monitoring risks the PM collects performance data and produces a progressively developed risk report summarising individual and overall risk."
      }
    ],
    "distractors": [
      { "text": "Risk avoidance", "trap": "A response strategy, not a monitoring tactic." },
      { "text": "Risk escalation", "trap": "A response strategy for risks outside the project's authority, not a monitoring tactic." },
      { "text": "Risk acceptance", "trap": "A response strategy, not a monitoring tactic." }
    ],
    "explanation": "Monitoring risks produces performance measures and a risk report; avoidance, escalation, and acceptance are risk RESPONSE strategies, not monitoring tactics.",
    "references": ["PMBOK Guide Seventh Edition", "The Standard for Risk Management (2019)"],
    "tags": ["monitor-risks", "risk-report"]
  }
]
