[
  {
    "id": "contrib-procurement-0001",
    "schema": "question/v1",
    "domain": "Process",
    "eco_task": "Plan and Manage Procurement",
    "topic": "Procurement",
    "subtopic": "Contract types",
    "difficulty": "medium",
    "type": "single",
    "select": 1,
    "present": 4,
    "prompts": [
      "Scope cannot be defined precisely enough to fix a price, so the buyer agrees to repay the seller's allowable actual costs plus a fee. Which contract type is this?"
    ],
    "correct": [
      { "text": "Cost-reimbursable contract", "why": "Allowable actual costs are reimbursed plus a fee; used when scope is uncertain at contract signing." }
    ],
    "distractors": [
      { "text": "Firm fixed-price (FFP) contract", "trap": "Sets a fixed price for defined work — inappropriate when scope is uncertain." },
      { "text": "Time and materials (T&M) contract", "trap": "A hybrid for small or staff-augmentation work, not the best fit for an uncertain full scope." },
      { "text": "Fixed-price incentive fee (FPIF) contract", "trap": "Still fixed-price based; requires a definable target scope." }
    ],
    "explanation": "Cost-reimbursable contracts repay legitimate actual costs plus a fee and suit uncertain scope, at the cost of closer buyer oversight.",
    "references": ["PMI Lexicon of Project Management Terms — Cost-reimbursable contract"],
    "tags": ["procurement", "contracts"],
    "contributor": "example-handle"
  }
]
